{
  "$schema": "https://json-schema.org/draft/2020-12/schema",
  "$id": "https://souroldgeezer.dev/schemas/architecture/layout-result.schema.json",
  "title": "Architecture layout result",
  "type": "object",
  "required": ["schemaVersion", "requestId", "backend", "mode", "deterministic", "readiness", "nodeGeometry", "edges", "metrics", "validation"],
  "additionalProperties": true,
  "properties": {
    "schemaVersion": { "const": "1.0" },
    "requestId": { "type": "string", "minLength": 1 },
    "backend": {
      "type": "object",
      "required": ["name", "version", "mode", "deterministic"],
      "additionalProperties": true
    },
    "mode": { "enum": ["generated-layout", "route-repair", "global-polish"] },
    "deterministic": { "type": "boolean" },
    "readiness": { "enum": ["success", "warning", "capped"] },
    "nodeGeometry": {
      "type": "array",
      "minItems": 1,
      "items": {
        "type": "object",
        "required": ["id", "x", "y", "w", "h"],
        "properties": {
          "id": { "type": "string", "minLength": 1 },
          "x": { "type": "integer" },
          "y": { "type": "integer" },
          "w": { "type": "integer", "minimum": 1 },
          "h": { "type": "integer", "minimum": 1 },
          "locked": { "type": "boolean" }
        }
      }
    },
    "edges": {
      "type": "array",
      "items": {
        "type": "object",
        "required": ["id", "source", "target", "sourcePort", "targetPort", "bendpoints", "route"],
        "properties": {
          "id": { "type": "string", "minLength": 1 },
          "source": { "type": "string", "minLength": 1 },
          "target": { "type": "string", "minLength": 1 },
          "sourcePort": { "type": "string" },
          "targetPort": { "type": "string" },
          "bendpoints": { "type": "array" },
          "route": {
            "type": "object",
            "required": ["status", "style"],
            "properties": {
              "status": { "type": "string" },
              "style": { "type": "string" }
            }
          }
        }
      }
    },
    "warnings": {
      "type": "array",
      "items": {
        "type": "object",
        "required": ["code", "severity", "message", "subjectIds"],
        "properties": {
          "code": { "type": "string" },
          "severity": { "enum": ["info", "warning", "error"] },
          "message": { "type": "string" },
          "subjectIds": { "type": "array", "items": { "type": "string" } }
        }
      }
    },
    "metrics": { "type": "object" },
    "validation": {
      "type": "object",
      "required": ["state"],
      "properties": {
        "state": { "enum": ["valid", "warning", "invalid"] }
      }
    }
  }
}
