{
  "schemaVersion": "1.0",
  "requestId": "materialize-oef-warning",
  "backend": {
    "name": "route-repair",
    "version": "1.0",
    "mode": "route-repair",
    "deterministic": true
  },
  "mode": "route-repair",
  "deterministic": true,
  "readiness": "capped",
  "nodeGeometry": [
    { "id": "id-node-app-payments", "x": 90, "y": 190, "w": 240, "h": 80 }
  ],
  "edges": [],
  "warnings": [
    {
      "code": "LAYOUT_CONNECTOR_NODE_INTERSECTION",
      "severity": "warning",
      "message": "Route crosses an unrelated node body.",
      "subjectIds": ["id-conn-payments-serves-orders"]
    }
  ],
  "metrics": {
    "nodeOverlaps": 0,
    "connectorNodeIntersections": 1,
    "connectorCrossings": 0,
    "lockedNodeDisplacement": 0
  },
  "validation": { "state": "warning" }
}
