{
  "schemaVersion": "1.0",
  "requestId": "service-realization-valid",
  "backend": { "name": "fixture", "version": "1.0", "mode": "generated-layout", "deterministic": true },
  "mode": "generated-layout",
  "deterministic": true,
  "readiness": "success",
  "nodeGeometry": [
    { "id": "business-process", "x": 40, "y": 40, "w": 160, "h": 72 },
    { "id": "application-service", "x": 40, "y": 220, "w": 160, "h": 72 },
    { "id": "application-component", "x": 40, "y": 400, "w": 160, "h": 72 }
  ],
  "edges": [
    { "id": "edge-realization", "source": "application-service", "target": "business-process", "sourcePort": "north", "targetPort": "south", "bendpoints": [{ "x": 120, "y": 180 }], "route": { "status": "routed", "style": "orthogonal" } },
    { "id": "edge-serving", "source": "application-component", "target": "application-service", "sourcePort": "north", "targetPort": "south", "bendpoints": [{ "x": 120, "y": 360 }], "route": { "status": "routed", "style": "orthogonal" } }
  ],
  "metrics": { "nodeOverlaps": 0, "connectorNodeIntersections": 0, "connectorCrossings": 0, "maxBends": 1, "averageBends": 1.0, "canvasWidth": 240, "canvasHeight": 512 },
  "validation": { "state": "valid" }
}
